{
  "title": "National Water Stewardship Outlook",
  "subtitle": "A Strategic Assessment for Sustainable Catchment Management",
  "publication_year": 2023,
  "language_as_iso639-2": "eng",
  "identifiers": {
    "ISBN": "000-0-0000001-0"
  },
  "publisher": [
    "Bureau of Public Utilities"
  ],
  "creator_persons": [
    "Mara Vintrell [author]",
    "Orun Hale [editor]"
  ],
  "creator_corporations": [
    "Hydrology Planning Office"
  ],
  "country_of_publication_iso639-1": [
    "us"
  ]
}