{
  "title": "Integrated Public Transport Harmonization Plan",
  "subtitle": "Cross-Regional Scheduling and Service Alignment Proposal",
  "publication_year": 2024,
  "language_as_iso639-2": "eng",
  "identifiers": { "ISBN": "099-9-4444441-9" },
  "publisher": ["Intermodal Mobility Coordination Office"],
  "creator_persons": [
    "Rina Velor",
    "Daren Solt"
  ],
  "creator_corporations": [
    "Transit Synchronization Laboratory"
  ],
  "country_of_publication_iso639-1": ["gb"]
}