  {
    "title": "National Energy Transition White Paper",
    "publication_year": 2024,
    "language_as_iso639-2": "eng",
    "publisher": [
      "Energy Transition Secretariat"
    ],
    "creator_persons": [
      "Luri Sen [policy advisor]"
    ],
    "creator_corporations": [
      "Green Systems Laboratory [research partner]"
    ],
    "country_of_publication_iso639-1": [
      "ud"
    ]
  }