{
  "title": "Aotearoa Cultural Heritage Digitisation Report",
  "subtitle": "Progress and Future Directions for National Preservation",
  "publication_year": 2021,
  "language_as_iso639-2": "eng",
  "identifiers": {
    "ISBN": "000-0-0000004-0"
  },
  "publisher": [
    "Te Tari Taonga Aotearoa (New Zealand Heritage Office)"
  ],
  "creator_persons": [
    "Mereana Raukawa [constributor]"
  ],
  "creator_corporations": [
    "Digital Aotearoa Programme [producer]"
  ],
  "country_of_publication_iso639-1": [
    "nz"
  ]
}