
  {
    "title": "Public Infrastructure Audit Summary",
    "subtitle": "Condition and Maintenance Needs Assessment",
    "publication_year": 2023,
    "language_as_iso639-2": "eng",
    "identifiers": {
      "ISBN": "000-0-0000006-0"
    },
    "publisher": [
      "Infrastructure Oversight Board"
    ],
    "creator_persons": [
      "Fenric Dol [author]"
    ],
    "creator_corporations": [
      "Civil Asset Review Office [analyst]"
    ],
    "country_of_publication_iso639-1": [
      "gb"
    ]
  }