  {
    "title": "Civic Health & Welfare Bulletin",
    "subtitle": "Trends in Community Support Services",
    "publication_year": 2021,
    "language_as_iso639-2": "eng",
    "identifiers": {
      "ISBN": "000-0-0000003-0"
    },
    "publisher": [
      "Public Wellbeing Directorate"
    ],
    "creator_persons": [
      "Idan Rell [editor]"
    ],
    "country_of_publication_iso639-1": [
      "en"
    ]
  }