  {
    "title": "Higher Education Quality Review",
    "subtitle": "Assessment of Teaching and Institutional Standards",
    "publication_year": 2022,
    "language_as_iso639-2": "eng",
    "identifiers": {
      "ISBN":null
    },
    "publisher": [
      "Council for Academic Evaluation"
    ],
    "creator_persons": [
      "Ona Relik [author]"
    ],
    "creator_corporations": [
      "Scholarly Standards Unit"
    ],
    "country_of_publication_iso639-1": [
      "gb"
    ]
  }